{
  "validation_schema_version": "1.1.0",
  "generated_at": "2026-03-08T05:26:45Z",
  "generated_at_utc": "2026-03-08T05:26:45Z",
  "inbox_root": "C:\\Users\\alanh\\AppData\\Local\\Temp\\zip_inbox_apply_smoke_dataset",
  "valid": true,
  "summary": {
    "project_count": 1,
    "zip_count": 0,
    "error_count": 0,
    "warning_count": 0
  },
  "errors": [],
  "warnings": [],
  "projects_detected": [
    "sample_project"
  ],
  "projects": [
    {
      "project_slug": "sample_project",
      "folder": "sample_project",
      "manifest_present": true,
      "zip_count": 0,
      "sequence_status": {
        "is_contiguous": true,
        "present_sequences": [],
        "missing_sequences": [],
        "duplicate_sequences": []
      },
      "valid": true,
      "errors": [],
      "warnings": [],
      "packages": []
    }
  ],
  "invalid_zip_files": []
}
