{
  "validation_schema_version": "1.1.0",
  "generated_at": "2026-03-08T05:26:36Z",
  "generated_at_utc": "2026-03-08T05:26:36Z",
  "inbox_root": "F:\\repos\\hitech-ia\\09_examples\\06_zip_inbox_registry\\10_inbox_smoke_dataset",
  "valid": true,
  "summary": {
    "project_count": 1,
    "zip_count": 2,
    "error_count": 0,
    "warning_count": 0
  },
  "errors": [],
  "warnings": [],
  "projects_detected": [
    "sample_project"
  ],
  "projects": [
    {
      "project_slug": "sample_project",
      "folder": "sample_project",
      "manifest_present": true,
      "zip_count": 2,
      "sequence_status": {
        "is_contiguous": true,
        "present_sequences": [
          1,
          2
        ],
        "missing_sequences": [],
        "duplicate_sequences": []
      },
      "valid": true,
      "errors": [],
      "warnings": [],
      "packages": [
        {
          "filename": "zip1_sample_project_core.zip",
          "sequence": 1,
          "project_slug": "sample_project",
          "package_slug": "core",
          "relative_path": "sample_project/zip1_sample_project_core.zip"
        },
        {
          "filename": "zip2_sample_project_validation.zip",
          "sequence": 2,
          "project_slug": "sample_project",
          "package_slug": "validation",
          "relative_path": "sample_project/zip2_sample_project_validation.zip"
        }
      ]
    }
  ],
  "invalid_zip_files": []
}
