{
  "validation_schema_version": "1.1.0",
  "generated_at": "2026-03-08T05:26:19Z",
  "generated_at_utc": "2026-03-08T05:26:19Z",
  "inbox_root": "F:\\repos\\hitech-ia\\02_modules\\_zip_inbox",
  "valid": true,
  "summary": {
    "project_count": 0,
    "zip_count": 0,
    "error_count": 0,
    "warning_count": 0
  },
  "errors": [],
  "warnings": [],
  "projects_detected": [],
  "projects": [],
  "invalid_zip_files": []
}
